{
  "$schema": "../../../_schemas/question-evidence.schema.json",
  "schemaVersion": "1.0",
  "domainSlug": "java-backend-fresher",
  "moduleSlug": "spring-boot-intro",
  "topicSlug": "embedded-server",
  "versionProfiles": [
    "java-17",
    "spring-boot-3.3.1"
  ],
  "styleSourceRefs": [
    "geeksforgeeks-java-style",
    "javatpoint-java-style",
    "interviewbit-java-style",
    "baeldung-java-style"
  ],
  "questionSlug": "tomcat-vs-jetty-vs-undertow-in-spring-boot",
  "questionText": "What embedded servers does Spring Boot support and how do you switch between them?",
  "contentHash": "sha256:fbb74db1d0fce485ec18f28cd5a137d329a5c20b8ba7c97e7f818bf74a230eea",
  "target": {
    "questionType": "comparison",
    "learningOutcome": "The learner can name Boot 3.3.1 server choices, replace the default starter correctly, and identify portable code and real selection boundaries without invented performance rankings.",
    "inScope": [
      "Tomcat, Jetty, and Undertow for servlet applications",
      "Reactor Netty default for WebFlux",
      "Maven dependency replacement",
      "JSP and server-specific configuration boundaries"
    ],
    "outOfScope": [
      "Universal speed or memory rankings",
      "A claim that server choice changes MVC into WebFlux"
    ],
    "prerequisites": [
      "Basic Maven dependencies",
      "Difference between Spring MVC and WebFlux"
    ]
  },
  "claims": [
    {
      "id": "supported-servlet-servers",
      "kind": "version",
      "classification": "documented_behavior",
      "statement": "Spring Boot 3.3 supports embedded Tomcat, Jetty, and Undertow for servlet applications, with Tomcat selected by the web starter by default.",
      "sectionTargets": [
        "quick_revision",
        "interview_answer",
        "deep_dive"
      ],
      "sourceRefs": [
        "spring-boot-3.3.1-reference"
      ],
      "versionDependent": true,
      "versionProfiles": [
        "spring-boot-3.3.1"
      ]
    },
    {
      "id": "reactive-server-choice",
      "kind": "comparison",
      "classification": "documented_behavior",
      "statement": "Spring WebFlux uses Reactor Netty by default and can also use supported servlet servers.",
      "sectionTargets": [
        "quick_revision",
        "interview_answer",
        "deep_dive"
      ],
      "sourceRefs": [
        "spring-boot-3.3.1-reference"
      ],
      "versionDependent": true,
      "versionProfiles": [
        "spring-boot-3.3.1"
      ]
    },
    {
      "id": "starter-replacement",
      "kind": "mechanism",
      "classification": "documented_behavior",
      "statement": "Switching a Spring MVC server requires excluding the Tomcat starter and adding the desired supported server starter.",
      "sectionTargets": [
        "quick_revision",
        "interview_answer",
        "deep_dive"
      ],
      "sourceRefs": [
        "spring-boot-3.3.1-reference"
      ],
      "versionDependent": true,
      "versionProfiles": [
        "spring-boot-3.3.1"
      ]
    },
    {
      "id": "jsp-boundary",
      "kind": "boundary",
      "classification": "documented_behavior",
      "statement": "Executable JAR packaging does not support JSP; Tomcat and Jetty can use JSP with WAR packaging, while Undertow does not support JSP.",
      "sectionTargets": [
        "quick_revision",
        "interview_answer",
        "deep_dive"
      ],
      "sourceRefs": [
        "spring-boot-3.3.1-reference"
      ],
      "versionDependent": true,
      "versionProfiles": [
        "spring-boot-3.3.1"
      ]
    }
  ],
  "examples": [
    {
      "id": "tomcat-to-jetty-maven",
      "kind": "xml",
      "title": "Maven dependency replacement from Tomcat to Jetty",
      "sectionTarget": "deep_dive",
      "claimRefs": [
        "supported-servlet-servers",
        "starter-replacement"
      ],
      "validation": {
        "method": "parse",
        "status": "passed",
        "command": "XML fence parsed with Python ElementTree and dependency coordinates checked",
        "expected": "The dependency fragment is well-formed XML, excludes the Tomcat starter, and adds the Jetty starter",
        "checkedAt": "2026-09-09",
        "checkedBy": "Codex embedded-server review"
      }
    }
  ],
  "visuals": [
    {
      "id": "server-choice-table",
      "kind": "comparison",
      "title": "Spring MVC and WebFlux server choice table",
      "claimRefs": [
        "supported-servlet-servers",
        "reactive-server-choice",
        "jsp-boundary"
      ],
      "reviewStatus": "verified",
      "reviewedAt": "2026-09-09",
      "reviewedBy": "Codex Mermaid and table review"
    }
  ],
  "notes": [
    "The comparison deliberately avoids unsupported claims that one server is always faster or smaller."
  ],
  "review": {
    "status": "fact_checked",
    "factChecked": {
      "by": "Codex Spring Boot documentation review",
      "at": "2026-09-09"
    },
    "notes": "Supported servers, defaults, dependency replacement, WebFlux options, and JSP boundaries were checked against official Spring Boot 3.3 web-server documentation."
  }
}
