{
  "$schema": "../../../_schemas/question-evidence.schema.json",
  "schemaVersion": "1.0",
  "contentHash": "sha256:220f70f100567ec0c0156372f4a54df0fa0852262f426b7d6821c75d0dd56f7d",
  "domainSlug": "java-backend-fresher",
  "moduleSlug": "spring-boot-intro",
  "topicSlug": "application-properties",
  "questionSlug": "application-properties-spring-boot-configuration-file",
  "questionText": "What is application.properties in Spring Boot?",
  "target": {
    "questionType": "definition",
    "learningOutcome": "The learner can define application.properties, write safe key-value settings, and explain how Spring Boot makes them available and overridable.",
    "inScope": ["Config-data loading", "Built-in and custom property keys", "Environment access and overrides", "Safe handling of secrets"],
    "outOfScope": ["The complete property-source precedence list", "Remote configuration servers", "Secret-manager setup"],
    "prerequisites": ["Basic Spring Boot application structure"]
  },
  "versionProfiles": ["java-17", "spring-boot-3.3.1", "spring-managed"],
  "styleSourceRefs": ["geeksforgeeks-java-style", "javatpoint-java-style", "interviewbit-java-style", "baeldung-java-style"],
  "claims": [
    {
      "id": "properties-config-data",
      "kind": "definition",
      "classification": "documented_behavior",
      "statement": "Spring Boot loads application.properties as config data and contributes its key-value settings to the Spring Environment.",
      "sectionTargets": ["quick_revision", "interview_answer", "deep_dive"],
      "sourceRefs": ["spring-boot-3.3.1-reference"],
      "versionDependent": true,
      "versionProfiles": ["spring-boot-3.3.1", "spring-managed"]
    },
    {
      "id": "default-config-locations",
      "kind": "behavior",
      "classification": "documented_behavior",
      "statement": "Spring Boot searches documented classpath and external locations for application configuration and allows higher-priority property sources to override matching keys.",
      "sectionTargets": ["interview_answer", "deep_dive"],
      "sourceRefs": ["spring-boot-3.3.1-reference"],
      "versionDependent": true,
      "versionProfiles": ["spring-boot-3.3.1"]
    },
    {
      "id": "typed-property-conversion",
      "kind": "behavior",
      "classification": "documented_behavior",
      "statement": "Spring Boot property binding and Spring conversion can turn external text such as 2s into a Java Duration rather than leaving every setting as a String.",
      "sectionTargets": ["deep_dive"],
      "sourceRefs": ["spring-boot-3.3.1-reference", "spring-framework-reference"],
      "versionDependent": true,
      "versionProfiles": ["spring-boot-3.3.1", "spring-managed"]
    }
  ],
  "examples": [
    {
      "id": "load-exact-properties-file",
      "kind": "configuration",
      "title": "Load and assert every property shown in the learner example",
      "sectionTarget": "deep_dive",
      "claimRefs": ["properties-config-data", "typed-property-conversion"],
      "validation": {
        "method": "integration_test",
        "status": "passed",
        "command": "Run the Java 17 Maven fixture with Spring Boot 3.3.1 and assert the exact application.properties values through ConfigurableEnvironment",
        "expected": "The name and port match, retry-count converts to int, and 2s converts to Duration.ofSeconds(2)",
        "checkedAt": "2026-09-09",
        "checkedBy": "codex-example-check"
      }
    }
  ],
  "visuals": [
    {
      "id": "property-sources-to-environment-flow",
      "kind": "flow",
      "title": "Property sources feeding Spring Environment and its consumers",
      "claimRefs": ["properties-config-data", "default-config-locations"],
      "reviewStatus": "verified",
      "reviewedAt": "2026-09-09",
      "reviewedBy": "codex-content-review"
    }
  ],
  "notes": ["The Mermaid diagram parsed and rendered in headless Chrome and uses only seven compact nodes.", "The learner example contains no password, token, or production secret."],
  "review": {
    "status": "example_verified",
    "factChecked": {"by": "codex-content-review", "at": "2026-09-09"},
    "exampleVerified": {"by": "codex-example-check", "at": "2026-09-09"},
    "notes": "Config-data locations, Environment behavior, override semantics, and conversion were checked against official Spring Boot 3.3.1 and Spring Framework documentation; the exact values passed an executable fixture."
  }
}
