{
  "$schema": "../../../_schemas/question-evidence.schema.json",
  "schemaVersion": "1.0",
  "domainSlug": "java-backend-fresher",
  "moduleSlug": "spring-boot-intro",
  "topicSlug": "embedded-server",
  "versionProfiles": [
    "java-17",
    "spring-boot-3.3.1"
  ],
  "styleSourceRefs": [
    "geeksforgeeks-java-style",
    "javatpoint-java-style",
    "interviewbit-java-style",
    "baeldung-java-style"
  ],
  "questionSlug": "https-configuration-in-spring-boot",
  "questionText": "How do you configure HTTPS for the Spring Boot embedded server?",
  "contentHash": "sha256:1f06cacc5e51b578925b9b44aee48360029400e56b56e5cbcc48e81ea9e93473",
  "target": {
    "questionType": "security",
    "learningOutcome": "The learner can configure a named SSL bundle for an embedded server, explain keystore and truststore roles, and choose between direct and proxy TLS termination.",
    "inScope": [
      "Certificate chain and private key",
      "JKS/PKCS12 SSL bundle configuration",
      "One-way HTTPS versus mutual TLS trust",
      "Application versus trusted-proxy termination"
    ],
    "outOfScope": [
      "Committing private keys or literal passwords",
      "A claim that a server truststore is required for ordinary one-way HTTPS"
    ],
    "prerequisites": [
      "Basic HTTPS and certificate idea",
      "Basic Spring Boot properties"
    ]
  },
  "claims": [
    {
      "id": "ssl-bundle-server-binding",
      "kind": "mechanism",
      "classification": "documented_behavior",
      "statement": "Spring Boot 3.3 can define named JKS or PEM SSL bundles and apply one to the embedded server using server.ssl.bundle.",
      "sectionTargets": [
        "quick_revision",
        "interview_answer",
        "deep_dive"
      ],
      "sourceRefs": [
        "spring-boot-3.3.1-reference"
      ],
      "versionDependent": true,
      "versionProfiles": [
        "spring-boot-3.3.1"
      ]
    },
    {
      "id": "keystore-truststore-direction",
      "kind": "security",
      "classification": "documented_behavior",
      "statement": "The server keystore supplies its identity and private key; a server truststore is needed when the server verifies client certificates, such as mutual TLS.",
      "sectionTargets": [
        "quick_revision",
        "interview_answer",
        "deep_dive"
      ],
      "sourceRefs": [
        "spring-boot-3.3.1-reference"
      ],
      "versionDependent": true,
      "versionProfiles": [
        "spring-boot-3.3.1"
      ]
    },
    {
      "id": "tls-termination-boundary",
      "kind": "boundary",
      "classification": "documented_behavior",
      "statement": "TLS may terminate in the embedded server or at a trusted proxy, and forwarded information must only be trusted according to the deployment configuration.",
      "sectionTargets": [
        "quick_revision",
        "interview_answer",
        "deep_dive"
      ],
      "sourceRefs": [
        "spring-boot-3.3.1-reference"
      ],
      "versionDependent": true,
      "versionProfiles": [
        "spring-boot-3.3.1"
      ]
    }
  ],
  "examples": [
    {
      "id": "pkcs12-ssl-bundle-properties",
      "kind": "configuration",
      "title": "Mounted PKCS12 SSL bundle for the embedded server",
      "sectionTarget": "deep_dive",
      "claimRefs": [
        "ssl-bundle-server-binding",
        "keystore-truststore-direction"
      ],
      "validation": {
        "method": "parse",
        "status": "passed",
        "command": "Focused embedded-server example gate parses SSL bundle and server keys and checks the environment placeholder",
        "expected": "The named web bundle uses a mounted PKCS12 path, external password placeholder, and server.ssl.bundle reference",
        "checkedAt": "2026-09-09",
        "checkedBy": "Codex embedded-server review"
      }
    }
  ],
  "visuals": [
    {
      "id": "tls-termination-flow",
      "kind": "decision",
      "title": "Direct embedded-server TLS versus trusted-proxy termination",
      "claimRefs": [
        "ssl-bundle-server-binding",
        "tls-termination-boundary"
      ],
      "reviewStatus": "verified",
      "reviewedAt": "2026-09-09",
      "reviewedBy": "Codex Mermaid and table review"
    }
  ],
  "notes": [
    "The content distinguishes server identity from client-certificate trust and never embeds a real secret."
  ],
  "review": {
    "status": "fact_checked",
    "factChecked": {
      "by": "Codex Spring Boot documentation review",
      "at": "2026-09-09"
    },
    "notes": "SSL bundle properties, key/trust roles, and embedded-server application were checked against official Spring Boot 3.3 SSL documentation. Deployment-specific proxy guidance is scoped as an operational boundary."
  }
}
