{
  "$schema": "../../../_schemas/question-evidence.schema.json",
  "schemaVersion": "1.0",
  "contentHash": "sha256:f21ba983f53f59837b51d842ac6268fb0dc27cf84f043149d82fcefc51cfc79d",
  "domainSlug": "java-backend-fresher",
  "moduleSlug": "rest-api-basics",
  "topicSlug": "json-basics",
  "questionSlug": "json-serialization-vs-deserialization",
  "questionText": "What is the difference between JSON serialization and deserialization?",
  "target": {
    "questionType": "comparison",
    "learningOutcome": "The learner can distinguish JSON serialization from deserialization, relate each direction to an API boundary, and explain why request and response shapes need not match.",
    "inScope": [
      "Java-to-JSON and JSON-to-Java directions",
      "Request and response DTO responsibilities",
      "Mapping failures versus validation failures",
      "Non-lossless round trips and sensitive-field boundaries",
      "Separate contract tests for each direction"
    ],
    "outOfScope": [
      "Jackson streaming API internals",
      "Custom serializer implementation",
      "ObjectMapper performance benchmarking"
    ],
    "prerequisites": [
      "Basic JSON syntax",
      "Basic Java DTOs"
    ]
  },
  "versionProfiles": [
    "java-17",
    "spring-boot-3.3.1",
    "spring-managed",
    "jakarta-validation-3.0"
  ],
  "styleSourceRefs": [
    "geeksforgeeks-java-style",
    "javatpoint-java-style",
    "interviewbit-java-style",
    "baeldung-java-style"
  ],
  "claims": [
    {
      "id": "opposite-mapping-directions",
      "kind": "comparison",
      "classification": "documented_behavior",
      "statement": "JSON serialization writes a Java value into a JSON representation, while deserialization reads JSON into a declared Java target type.",
      "sectionTargets": [
        "quick_revision",
        "interview_answer",
        "deep_dive"
      ],
      "sourceRefs": [
        "spring-framework-reference"
      ],
      "versionDependent": true,
      "versionProfiles": [
        "spring-managed"
      ]
    },
    {
      "id": "mapping-does-not-validate-domain",
      "kind": "boundary",
      "classification": "documented_behavior",
      "statement": "Successful JSON-to-Java mapping establishes that conversion succeeded, but Bean Validation constraints and service-level domain rules remain separate checks.",
      "sectionTargets": [
        "quick_revision",
        "interview_answer",
        "deep_dive"
      ],
      "sourceRefs": [
        "spring-framework-reference",
        "jakarta-validation-3.0"
      ],
      "versionDependent": true,
      "versionProfiles": [
        "spring-managed",
        "jakarta-validation-3.0"
      ]
    },
    {
      "id": "direction-specific-contracts",
      "kind": "guidance",
      "classification": "canonical_guidance",
      "statement": "An API can deliberately accept one JSON shape and return another because client input, server-generated data, and public output have different responsibilities.",
      "sectionTargets": [
        "interview_answer",
        "deep_dive"
      ],
      "sourceRefs": [
        "spring-framework-reference",
        "rfc-8259-json"
      ],
      "versionDependent": false
    }
  ],
  "examples": [
    {
      "id": "distinct-request-response-mapping",
      "kind": "java",
      "title": "Compile and run the exact example with different request and response records",
      "sectionTarget": "deep_dive",
      "claimRefs": [
        "opposite-mapping-directions",
        "direction-specific-contracts"
      ],
      "validation": {
        "method": "unit_test",
        "status": "passed",
        "command": "Run mvn -q test with Java 17 and the Spring Boot 3.3.1 managed Jackson version against the exact JsonDirectionExample",
        "expected": "The request JSON is read into CreateOrderRequest; the response JSON contains id, productId, and status but does not contain request-only quantity",
        "checkedAt": "2026-09-09",
        "checkedBy": "codex-example-check"
      }
    }
  ],
  "visuals": [
    {
      "id": "direction-comparison-table",
      "kind": "comparison",
      "title": "Serialization and deserialization compared by direction, control, risk, and next step",
      "claimRefs": [
        "opposite-mapping-directions",
        "mapping-does-not-validate-domain",
        "direction-specific-contracts"
      ],
      "reviewStatus": "verified",
      "reviewedAt": "2026-09-09",
      "reviewedBy": "codex-content-review"
    }
  ],
  "notes": [
    "The former same-DTO round-trip example was replaced because it contradicted the lesson's most useful boundary lesson.",
    "The comparison table supports scanning while the deep explanation remains an independent mini-article."
  ],
  "review": {
    "status": "example_verified",
    "factChecked": {
      "by": "codex-content-review",
      "at": "2026-09-09"
    },
    "exampleVerified": {
      "by": "codex-example-check",
      "at": "2026-09-09"
    },
    "notes": "Spring message-conversion behavior and Jakarta Validation boundaries were checked against official documentation. The revised Java 17 example passed with the Jackson version managed by Spring Boot 3.3.1 and proved the distinct response shape."
  }
}
