{
  "$schema": "../../../_schemas/question-evidence.schema.json",
  "schemaVersion": "1.0",
  "domainSlug": "java-backend-fresher",
  "moduleSlug": "rest-api-basics",
  "topicSlug": "api-design-basics",
  "questionSlug": "rest-uri-design-principles",
  "questionText": "What are the principles of good REST API URI design?",
  "contentHash": "sha256:d098af80b234599969e80a4dbfe086a064d6f39486499b087996e0f556438d47",
  "target": {
    "questionType": "when_to_use_or_design",
    "learningOutcome": "The learner can design stable resource identifiers, separate a resource URI from the HTTP action, and choose sensible collection, member, relationship, and query shapes.",
    "inScope": ["Resource and representation identifiers", "Collection and member paths", "Shallow relationship paths", "Query controls", "Naming conventions versus REST requirements"],
    "outOfScope": ["A claim that plural nouns or lowercase paths are required by REST", "Database table or controller naming"],
    "prerequisites": ["Basic URI structure", "Basic HTTP methods"]
  },
  "versionProfiles": ["http-rfc-9110"],
  "styleSourceRefs": ["geeksforgeeks-java-style", "javatpoint-java-style", "interviewbit-java-style", "baeldung-java-style"],
  "claims": [
    {
      "id": "rest-identifies-resources",
      "kind": "definition",
      "classification": "canonical_guidance",
      "statement": "REST uses resource identifiers to identify the resource involved in an interaction and manipulates resources through representations under a uniform interface.",
      "sectionTargets": ["quick_revision", "interview_answer", "deep_dive"],
      "sourceRefs": ["fielding-rest-dissertation"],
      "versionDependent": false
    },
    {
      "id": "method-supplies-action-semantics",
      "kind": "behavior",
      "classification": "normative",
      "statement": "For an HTTP API, the request method supplies the request semantics, so a resource identifier does not need to repeat GET, POST, or DELETE as a path verb.",
      "sectionTargets": ["quick_revision", "interview_answer", "deep_dive"],
      "sourceRefs": ["rfc-9110-http-semantics"],
      "versionDependent": false
    },
    {
      "id": "query-is-part-of-identifier",
      "kind": "definition",
      "classification": "normative",
      "statement": "A URI query component contains non-hierarchical data that, together with the path, serves to identify a resource within the URI scheme and naming authority.",
      "sectionTargets": ["interview_answer", "deep_dive"],
      "sourceRefs": ["rfc-3986-uri"],
      "versionDependent": false
    },
    {
      "id": "path-spelling-is-convention",
      "kind": "boundary",
      "classification": "canonical_guidance",
      "statement": "Plural nouns, lowercase paths, hyphens, and shallow nesting are consistency conventions; REST itself requires meaningful resource identification rather than one mandatory spelling style.",
      "sectionTargets": ["quick_revision", "interview_answer", "deep_dive"],
      "sourceRefs": ["fielding-rest-dissertation", "rfc-3986-uri"],
      "versionDependent": false
    }
  ],
  "examples": [{
    "id": "order-resource-requests",
    "kind": "http",
    "title": "Filtered orders and an order-item collection request",
    "sectionTarget": "deep_dive",
    "claimRefs": ["method-supplies-action-semantics", "query-is-part-of-identifier"],
    "validation": {"method": "manual_review", "status": "manual_review", "command": "Review request lines, Host fields, media type, and JSON body against RFC 9110 and RFC 3986", "expected": "The paths identify resources and the methods carry the requested operation", "checkedAt": "2026-09-09", "checkedBy": "Codex REST review"}
  }],
  "visuals": [{
    "id": "order-resource-map",
    "kind": "hierarchy",
    "title": "Collection, member, owned collection, direct identifier, and filtered view",
    "claimRefs": ["rest-identifies-resources", "query-is-part-of-identifier", "path-spelling-is-convention"],
    "reviewStatus": "verified",
    "reviewedAt": "2026-09-09",
    "reviewedBy": "Codex Mermaid review"
  }],
  "notes": ["The route shapes are teaching conventions, not invented REST syntax requirements.", "The Mermaid block was parsed with the repository's Mermaid 11.14.0 dependency."],
  "review": {"status": "fact_checked", "factChecked": {"by": "Codex REST and URI review", "at": "2026-09-09"}, "notes": "Resource, URI-query, and HTTP-method claims were checked against Fielding, RFC 3986, and RFC 9110; naming advice is explicitly scoped as convention."}
}
